{
  "$schema": "registry.schema.json",
  "schemaVersion": 1,
  "library": "Strata",
  "version": "0.3.0",
  "releaseStatus": "released",
  "releaseUnit": {"ecosystem": "swiftpm", "product": "Strata", "module": "Strata"},
  "releaseUnits": {
    "strata": "README.md",
    "designTokens": "../Packages/DesignTokens/ai/README.md"
  },
  "documents": {
    "entry": "README.md",
    "usage": "USAGE.md",
    "integration": "INTEGRATION.md",
    "examples": "EXAMPLES.md",
    "compatibility": "COMPATIBILITY.md",
    "migration": "MIGRATION.md",
    "changelog": "../CHANGELOG.md"
  },
  "capabilities": [{
    "id": "strata-token-color",
    "symbol": "StrataTokenColor.resolve(_:theme:)",
    "source": "../Sources/Strata/StrataTokenColor.swift",
    "documentation": "USAGE.md",
    "example": "examples/consumer/Sources/SamplePalette/SamplePalette.swift"
  }]
}
